company,date,title,link
,1일 전,안와르 말레이시아 총리  내달 태국 방문,https://www.yna.co.kr/view/AKR20230123021700076?input=1195m
,1일 전,돌아온 큰손? 중국인 관광객에 태국 '들썩',https://news.sbs.co.kr/news/endPage.do?news_id=N1007053687&plink=ORI&cooper=NAVER
,21시간 전,日 이어 태국도 합법화… 불붙은 亞 카지노 개발 경쟁,http://www.edaily.co.kr/news/newspath.asp?newsid=01482566635480672
,5시간 전,YG 베이비몬스터  13세 최연소 태국 멤버 치키타 '화제',https://www.hankyung.com/entertainment/article/202301240144H
,10시간 전,이게 진짜 태국 음식? 대학가에 이런 보석이 숨겨져 있었다니,https://www.chosun.com/economy/startup_story/2023/01/24/KRQNHOXEDJBM7ADXXFFKY6USWY/?utm_source=naver&utm_medium=referral&utm_campaign=naver-news
,1시간 전,"큰손 중국인 오신다"...돈 받고 '공항 의전' 제공한 태국 경찰 기소,https://hankookilbo.com/News/Read/A2023012413590003419?did=NA
,1일 전,베이비몬스터 세 번째 멤버=‘13세 태국소녀’ 치기타…소울풀한 보컬 라이브...,https://www.mk.co.kr/article/10615427?refer=portal
,2일 전,태국서 평화 촉구하는 무슬림 女,https://www.news1.kr/photos/view/?5800928
,2일 전,태국 군경  남부 분쟁지역서 무장반군과 교전…"3명 사살",https://www.yna.co.kr/view/AKR20230122012400084?input=1195m
,2시간 전,2월 풀리는 中 단체관광  한·일 제외한 태국 등 동남아로 몰릴 듯..“상품 검...,http://kpenews.com/View.aspx?No=2694124
